{
  "schema_version": "operations-production-readiness-evidence.v1",
  "as_of_date": "2026-08-29",
  "business_timezone": "Australia/Sydney",
  "scope": "PRIVATE_OPERATIONS_STAGING",
  "evidence_boundary": "SYNTHETIC_ENGINEERING_ONLY",
  "execution": {
    "mode": "OFFLINE_REPOSITORY_EVIDENCE_RECONCILIATION",
    "network_access": false,
    "external_writes_executed": false
  },
  "authority": {
    "production_deployment_authorized": false,
    "production_alias_change_authorized": false,
    "recurring_schedule_authorized": false,
    "production_table_write_authorized": false,
    "operational_mutation_authorized": false,
    "policy_activation_authorized": false,
    "model_promotion_authorized": false
  },
  "required_gates": [
    {
      "id": "authenticated_access_and_rbac",
      "state": "RUNTIME_VERIFIED_STAGING",
      "evidence_class": "STAGING_ENGINEERING",
      "evidence_refs": [
        "CURRENT_DEVELOPMENT_STATUS.md",
        "docs/operations_api_v1.md"
      ],
      "finding": "Authenticated route protection and the four-role allow/deny matrix passed in private staging; temporary users were removed."
    },
    {
      "id": "mutation_idempotency_and_concurrency",
      "state": "RUNTIME_VERIFIED_STAGING",
      "evidence_class": "STAGING_ENGINEERING",
      "evidence_refs": [
        "docs/runbooks/operations_api_reliability.md"
      ],
      "finding": "Sequential and concurrent replay preserved one immutable audit event in the bounded staging reliability exercise."
    },
    {
      "id": "controlled_dependency_failure_and_recovery",
      "state": "RUNTIME_VERIFIED_STAGING",
      "evidence_class": "STAGING_ENGINEERING",
      "evidence_refs": [
        "docs/runbooks/operations_api_reliability.md"
      ],
      "finding": "A bounded staging dependency isolation produced controlled 503 behavior and the original configuration was restored."
    },
    {
      "id": "throttling_alarm_and_recovery",
      "state": "RUNTIME_VERIFIED_STAGING",
      "evidence_class": "STAGING_ENGINEERING",
      "evidence_refs": [
        "docs/runbooks/operations_api_reliability.md"
      ],
      "finding": "A bounded 429 burst exercised the staging throttle alarm and recovery to OK with the original limits restored."
    },
    {
      "id": "sustained_read_load",
      "state": "PARTIAL_EVIDENCE",
      "evidence_class": "STAGING_ENGINEERING",
      "evidence_refs": [
        "docs/operations_authenticated_read_load_plan_v1.json",
        "docs/operations_authenticated_read_load_baseline_v1.schema.json",
        "ops/simulate_operations_authenticated_read_load.py",
        "ops/run_operations_authenticated_read_load_staging.ps1",
        "docs/runbooks/operations_api_reliability.md"
      ],
      "finding": "After the earlier failed-closed attempts and the separately authorized 2026-08-29 route-localizing run, manual workflow run 33220634162 deployed commit 66eeb52 with a bounded correction that starts the two unchanged mandatory outcomes_pending queries together with exactly two workers and fails the complete response closed if either query fails. One separately authorized post-deployment observation then preserved the frozen workload and 3000 ms gate. 20 of 20 responses were successful with zero throttles or other errors, but overall p95 latency was 4996 ms and the run aborted. The three outcomes_pending samples had p95 2913 ms, below the gate; four of the other six safe route aggregates exceeded it and two were below it. The temporary viewer was confirmed removed, no result artifact was persisted, and no retry followed. The three outcomes_pending samples remain descriptive only; they do not establish causal improvement or production performance. No completed sustained-load baseline exists."
    },
    {
      "id": "security_negative_suite",
      "state": "PARTIAL_EVIDENCE",
      "evidence_class": "STAGING_ENGINEERING",
      "evidence_refs": [
        "CURRENT_DEVELOPMENT_STATUS.md",
        "docs/operations_api_v1.md"
      ],
      "finding": "Unauthenticated rejection, exact-origin CORS, redacted logs, and role denials are verified; a broader governed security exercise is not complete."
    },
    {
      "id": "athena_query_cost_baseline",
      "state": "NOT_EXECUTED",
      "evidence_class": "NONE",
      "evidence_refs": [
        "docs/production_readiness_contract.json"
      ],
      "finding": "Operations API read and operational-baseline query classes still require measured scan baselines before enforcement."
    },
    {
      "id": "backup_restore_exercise",
      "state": "NOT_EXECUTED",
      "evidence_class": "NONE",
      "evidence_refs": [
        "docs/data_governance_operations.md"
      ],
      "finding": "No governed backup-and-restore exercise has established the proposed staging recovery target."
    },
    {
      "id": "iceberg_maintenance_exercise",
      "state": "NOT_EXECUTED",
      "evidence_class": "NONE",
      "evidence_refs": [
        "docs/data_governance_operations.md"
      ],
      "finding": "Compaction, snapshot expiration, and orphan-file cleanup remain plan-only and unexecuted."
    },
    {
      "id": "slo_incident_ownership_exercise",
      "state": "DESIGNED_NOT_EXERCISED",
      "evidence_class": "REPOSITORY_ENGINEERING",
      "evidence_refs": [
        "docs/data_governance_operations.md",
        "docs/production_readiness_contract.json"
      ],
      "finding": "Engineering targets and incident severity are documented, but named ownership and an end-to-end exercise are not evidenced."
    }
  ],
  "summary": {
    "required_gate_count": 10,
    "eligible_gate_count": 4,
    "blocked_gate_count": 6,
    "production_readiness": false
  },
  "claim_boundary": {
    "status": "NOT_READY_INCOMPLETE_EVIDENCE",
    "real_logistics_performance": false,
    "production_sla": false,
    "production_readiness": false
  }
}
